{
  "$schema": "http://json-schema.org/draft-07/schema#",
  "title": "IC Reactor Configuration",
  "description": "Configuration file for @ic-reactor/cli and @ic-reactor/vite-plugin",
  "type": "object",
  "properties": {
    "$schema": {
      "type": "string",
      "description": "JSON Schema reference"
    },
    "outDir": {
      "type": "string",
      "description": "Default output directory for generated files (relative to project root)",
      "default": "src/declarations"
    },
    "clientManagerPath": {
      "type": "string",
      "description": "Default import path for the client manager (relative from generated files)",
      "default": "../../clients"
    },
    "target": {
      "type": "string",
      "enum": ["react", "core"],
      "description": "Default generated runtime target (react emits hooks, core emits only reactor exports)",
      "default": "react"
    },
    "canisters": {
      "type": "object",
      "description": "Canister configurations",
      "additionalProperties": {
        "type": "object",
        "properties": {
          "name": {
            "type": "string",
            "pattern": "^[A-Za-z0-9_.-]+$",
            "maxLength": 64,
            "description": "Canister name (required). May contain only letters, digits, '_', '.' and '-' — it becomes a directory name. It must also derive a valid TypeScript identifier, so a name beginning with a digit (e.g. '2048_game') is rejected at generation time."
          },
          "didFile": {
            "type": "string",
            "description": "Path to the .did file (required)"
          },
          "outDir": {
            "type": "string",
            "description": "Override output directory for this canister"
          },
          "clientManagerPath": {
            "type": "string",
            "description": "Override client manager import path for this canister"
          },
          "mode": {
            "type": "string",
            "enum": [
              "Reactor",
              "DisplayReactor",
              "CandidReactor",
              "CandidDisplayReactor",
              "MetadataDisplayReactor"
            ],
            "description": "Reactor class used for generated hooks (defaults to DisplayReactor)"
          },
          "target": {
            "type": "string",
            "enum": ["react", "core"],
            "description": "Generated runtime target for this canister (react emits hooks, core emits only reactor exports)"
          },
          "canisterId": {
            "type": "string",
            "description": "Canister ID written into index.generated.ts. Set it for any build not served from a local replica: without it the generated reactor reads the id from the ic_env cookie, and importing it throws in Node, during SSR and on a deployed origin."
          }
        },
        "required": ["name", "didFile"]
      }
    }
  },
  "required": ["outDir", "canisters"]
}
