{
  "$schema": "https://raw.githubusercontent.com/B3Pay/ic-reactor/main/packages/cli/schema.json",
  "outDir": "frontend/src/canisters",
  "clientManagerPath": "../../lib/client",
  "target": "react",
  "canisters": {
    "backend": {
      "name": "backend",
      "didFile": "backend/backend.did"
    }
  }
}
